{
  "display_name": "1337x",
  "enabled": true,
  "id": "x1337x",
  "kind": "html",
  "mirrors": [
    "https://1337x.to",
    "https://1337x.st",
    "https://x1337x.ws",
    "https://x1337x.eu",
    "https://x1337x.cc"
  ],
  "origin": {
    "jackett_id": "1337x",
    "kind": "jackett",
    "last_verified": "2026-10-17T08:37:27Z"
  },
  "pages": 2,
  "request": {
    "delay_ms": 1200,
    "headers": {
      "Accept": "text/html,application/xhtml+xml",
      "Accept-Language": "en-US,en;q=0.9"
    },
    "min_seeds_for_detail_fetch": 1
  },
  "search_path": "/search/{query}/{page}/",
  "selectors": {
    "detail_link": "td.coll-1 a:last-of-type[href^=\"/torrent/\"]",
    "detail_link_attr": "href",
    "detail_magnet_selector": "a[href^=\"magnet:\"]",
    "detail_magnet_selector_fallback": "ul li a[href^=\"magnet:?xt=\"]",
    "magnet_location": "detail",
    "peers": "td.coll-3",
    "peers_index": 0,
    "row": "tr:has(a[href^=\"/torrent/\"])",
    "seeds": "td.coll-2",
    "seeds_index": 0,
    "size": "td.coll-4",
    "title": "td.coll-1 a:last-of-type[href^=\"/torrent/\"]",
    "title_attr": "text",
    "title_fallback_href_segment": 3,
    "title_fallback_href_selector": "td.coll-1 a:last-of-type[href^=\"/torrent/\"]"
  }
}
