{
  "display_name": "TheRARBG",
  "enabled": true,
  "id": "therarbg",
  "imdb_path": "/get-posts/order:-se:category:Movies:keywords:{imdb_id}:paginate_by:50:format:json/",
  "json_fields": {
    "category": "c",
    "infohash": "h",
    "infohash_is_full_magnet": false,
    "peers": "le",
    "results_array": "results",
    "seeds": "se",
    "size": "s",
    "title": "n"
  },
  "kind": "json",
  "mirrors": [
    "https://therarbg.to",
    "https://therarbg.com",
    "https://rarbg.ninjaproxy1.com",
    "https://rarbg.proxyninja.org",
    "https://rarbg.torrentbay.st"
  ],
  "origin": {
    "jackett_id": "therarbg",
    "kind": "jackett",
    "last_verified": "2026-10-17T08:37:27Z"
  },
  "request": {
    "delay_ms": 0,
    "headers": {
      "Accept": "application/json"
    }
  },
  "search_path": "/get-posts/order:-se:category:Movies:keywords:{query}:paginate_by:50:format:json/"
}
