{
  "display_name": "KickassTorrents-WS",
  "enabled": true,
  "id": "kat_ws",
  "kind": "html",
  "mirrors": [
    "https://kickass.ws",
    "https://kickasstorrents.bz",
    "https://kkickass.com",
    "https://kkat.net",
    "https://kick4ss.com",
    "https://kickasst.net",
    "https://kickasstorrents.id",
    "https://thekat.cc",
    "https://kattracker.com"
  ],
  "origin": {
    "jackett_id": "kickasstorrents-ws",
    "kind": "jackett",
    "last_verified": "2026-10-17T08:37:26Z"
  },
  "pages": 1,
  "request": {
    "delay_ms": 0,
    "headers": {
      "Accept": "text/html,application/xhtml+xml",
      "Accept-Language": "en-US,en;q=0.9"
    }
  },
  "search_path": "/usearch/{query}/?field=time_add&sorder=desc",
  "selectors": {
    "magnet": "td:nth-child(1) > div > a[data-download]",
    "magnet_attr": "href",
    "magnet_location": "listing",
    "magnet_querystring_param": "url",
    "peers": "td:nth-child(5)",
    "peers_index": 0,
    "row": "table.data tr[id]:has(a[data-download])",
    "seeds": "td:nth-child(4)",
    "seeds_index": 0,
    "size": "td:nth-child(2)",
    "title": "a[class=\"cellMainLink\"]",
    "title_attr": "text"
  }
}
