{
  "display_name": "ThePirateBay",
  "enabled": true,
  "id": "tpb",
  "json_fields": {
    "apply_tpb_query_cleanup": true,
    "imdb": "imdb",
    "infohash": "info_hash",
    "infohash_is_full_magnet": false,
    "peers": "leechers",
    "results_array": "",
    "seeds": "seeders",
    "size": "size",
    "title": "name"
  },
  "kind": "json",
  "mirrors": [
    "https://thepiratebay.org",
    "https://thepiratebay.ninjaproxy1.com",
    "https://tpb.proxyninja.org",
    "https://thepiratebay.torrentbay.st",
    "https://mirrorbay.top",
    "https://thepiratebay0.org",
    "https://thepiratebay10.xyz",
    "https://pirateproxylive.org",
    "https://thehiddenbay.com",
    "https://thepiratebay.zone",
    "https://tpb.party",
    "https://piratebayproxy.live",
    "https://piratebay.live",
    "https://piratebay.party",
    "https://thepiratebay.party",
    "https://thepiratebay.cloud",
    "https://tpb.re"
  ],
  "origin": {
    "jackett_id": "thepiratebay",
    "kind": "jackett",
    "last_verified": "2026-10-17T08:37:27Z"
  },
  "pages": 1,
  "request": {
    "delay_ms": 0,
    "headers": {
      "Accept": "application/json"
    }
  },
  "search_path": "/q.php?q={query}&cat="
}
