{
  "display_name": "KickassTorrents",
  "enabled": true,
  "excluded_mirrors": [
    "https://kickasstorrents.unblockninja.com"
  ],
  "id": "kat",
  "kind": "html",
  "mirrors": [
    "https://kickass.torrentbay.st",
    "https://kickass.torrentsbay.org",
    "https://kickasstorrents.ninjaproxy1.com",
    "https://kickasstorrents.proxyninja.org"
  ],
  "origin": {
    "jackett_id": "kickasstorrents-to",
    "kind": "jackett",
    "last_verified": "2026-10-24T08:55:09Z"
  },
  "pages": 1,
  "request": {
    "delay_ms": 1500,
    "headers": {
      "Accept": "text/html,application/xhtml+xml",
      "Accept-Language": "en-US,en;q=0.9"
    }
  },
  "search_path": "/search/?q={query}",
  "selectors": {
    "magnet": "a[href^=\"magnet:?xt=\"]",
    "magnet_attr": "href",
    "magnet_location": "listing",
    "peers": "td:nth-child(6)",
    "peers_index": 0,
    "row": "table.data > tbody > tr:has(a[href^=\"magnet:?xt=\"])",
    "seeds": "td:nth-child(5)",
    "seeds_index": 0,
    "size": "td:nth-child(2)",
    "title": "a.cellMainLink",
    "title_attr": "text"
  }
}
