{
  "display_name": "ExtraTorrent",
  "enabled": true,
  "id": "extratorrent",
  "kind": "html",
  "mirrors": [
    "https://extratorrent.st",
    "https://extratorrent.ninjaproxy1.com",
    "https://extratorrent.proxyninja.org"
  ],
  "origin": {
    "jackett_id": "extratorrent-st",
    "kind": "jackett",
    "last_verified": "2026-10-24T08:55:09Z"
  },
  "pages": 1,
  "request": {
    "delay_ms": 0,
    "headers": {
      "Accept": "text/html,application/xhtml+xml",
      "Accept-Language": "en-US,en;q=0.9"
    }
  },
  "search_path": "/search/?srt=added&order=desc&search={query}&new=1&x=0&y=0",
  "selectors": {
    "category": "span.c_tor",
    "magnet": "a[href^=\"magnet:?xt=\"]",
    "magnet_attr": "href",
    "magnet_location": "listing",
    "peers": "td.ly, td.ln",
    "peers_index": 0,
    "row": "tr[class^=\"tl\"]:has(a[href^=\"magnet:?xt=\"])",
    "seeds": "td.sy, td.sn",
    "seeds_index": 0,
    "size": "td:nth-last-of-type(4)",
    "title": "a[href^=\"/torrent/\"]",
    "title_attr": "text"
  }
}
