{
  "display_name": "TorrentGalaxy",
  "enabled": true,
  "id": "tgx",
  "imdb_path": "/get-posts/keywords:{imdb_id}",
  "kind": "html",
  "mirrors": [
    "https://torrentgalaxy.online",
    "https://torrentgalaxy.info"
  ],
  "origin": {
    "jackett_id": "torrentgalaxyclone",
    "kind": "jackett",
    "last_verified": "2026-10-31T10:26:13Z"
  },
  "pages": 1,
  "request": {
    "delay_ms": 0,
    "headers": {
      "Accept": "text/html,application/xhtml+xml",
      "Accept-Language": "en-US,en;q=0.9"
    }
  },
  "search_path": "/get-posts/keywords:{query}",
  "selectors": {
    "magnet": "a[href^=\"magnet:?xt=\"]",
    "magnet_attr": "href",
    "magnet_location": "listing",
    "peers": "div.tgxtablecell:nth-last-child(2) span font",
    "peers_index": 1,
    "row": "div.tgxtablerow",
    "seeds": "div.tgxtablecell:nth-last-child(2) span font",
    "seeds_index": 0,
    "size": "div.tgxtablecell:nth-last-child(5)",
    "title": "a[href^=\"/post-detail/\"]",
    "title_attr": "title"
  }
}
